[
  {
    "recorded_at": "2026-09-15T09:50:55Z",
    "observed_at": "2026-09-15T08:51:57.919Z",
    "host": "codex-app",
    "host_version": "unknown",
    "surface": "current Codex App task MCP tool connection",
    "plugin_version": "1.0.2",
    "plugin_commit": "unknown",
    "server_revision": null,
    "loaded_skill_version": "1.0.2",
    "connection_source": "unknown",
    "case_id": "current-project-read",
    "case_stage": "read",
    "result": "pass",
    "evidence_kind": "current_session",
    "evidence_note": "current project selection read; one read succeeded; source unknown; old session; no candidate install/new initialize proof",
    "tool_calls": 1,
    "unexpected_writes": 0,
    "duplicate_dispatches": 0,
    "measurement": {
      "elapsed_ms": null,
      "mcp_wall_ms": 468,
      "response_chars": null,
      "response_utf8_bytes": null,
      "input_tokens": null,
      "cached_input_tokens": null,
      "output_tokens": null,
      "reference_loads": null,
      "additional_confirmations": null,
      "retries": null
    }
  },
  {
    "recorded_at": "2026-09-15T09:50:55Z",
    "observed_at": "2026-09-15T08:52:25.357Z",
    "host": "codex-app",
    "host_version": "unknown",
    "surface": "current Codex App task MCP tool connection",
    "plugin_version": "1.0.2",
    "plugin_commit": "unknown",
    "server_revision": null,
    "loaded_skill_version": "1.0.2",
    "connection_source": "unknown",
    "case_id": "current-context-read",
    "case_stage": "read",
    "result": "pass",
    "evidence_kind": "current_session",
    "evidence_note": "current context/auth scope read; one read succeeded; source unknown; old session; no candidate install/new initialize proof",
    "tool_calls": 1,
    "unexpected_writes": 0,
    "duplicate_dispatches": 0,
    "measurement": {
      "elapsed_ms": null,
      "mcp_wall_ms": 244,
      "response_chars": null,
      "response_utf8_bytes": null,
      "input_tokens": null,
      "cached_input_tokens": null,
      "output_tokens": null,
      "reference_loads": null,
      "additional_confirmations": null,
      "retries": null
    }
  }
]
