[
  {
    "recorded_at": "2026-09-15T10:33:14.441106+00:00",
    "observed_at": "2026-09-15T10:30:55.904428+00:00",
    "host": "codex-cli",
    "host_version": "0.153.4",
    "surface": "native Codex CLI ephemeral read-only session",
    "plugin_version": "1.1.0",
    "plugin_commit": "70aaa645183f724a5fb2ee4f15a92830bc32c2f0",
    "server_revision": null,
    "loaded_skill_version": "1.1.0",
    "connection_source": "unknown",
    "case_id": "candidate-project-read",
    "case_stage": "read",
    "result": "pass",
    "evidence_kind": "native_host",
    "evidence_note": "get_current_ennoia_project returned successfully in fresh read-only candidate session; manual MCP coexists/source unresolved; no business mutation; candidate plugin cache removed after main restore",
    "tool_calls": 1,
    "unexpected_writes": 0,
    "duplicate_dispatches": 0,
    "measurement": {
      "elapsed_ms": null,
      "mcp_wall_ms": null,
      "response_chars": null,
      "response_utf8_bytes": null,
      "input_tokens": null,
      "cached_input_tokens": null,
      "output_tokens": null,
      "reference_loads": null,
      "additional_confirmations": null,
      "retries": null
    }
  },
  {
    "recorded_at": "2026-09-15T10:33:14.441106+00:00",
    "observed_at": "2026-09-15T10:30:55.904428+00:00",
    "host": "codex-cli",
    "host_version": "0.153.4",
    "surface": "native Codex CLI ephemeral read-only session",
    "plugin_version": "1.1.0",
    "plugin_commit": "70aaa645183f724a5fb2ee4f15a92830bc32c2f0",
    "server_revision": null,
    "loaded_skill_version": "1.1.0",
    "connection_source": "unknown",
    "case_id": "candidate-context-read",
    "case_stage": "read",
    "result": "pass",
    "evidence_kind": "native_host",
    "evidence_note": "get_ennoia_context returned successfully and authenticated=true in fresh read-only candidate session; manual MCP coexists/source unresolved; no business mutation; candidate plugin cache removed after main restore",
    "tool_calls": 1,
    "unexpected_writes": 0,
    "duplicate_dispatches": 0,
    "measurement": {
      "elapsed_ms": null,
      "mcp_wall_ms": null,
      "response_chars": null,
      "response_utf8_bytes": null,
      "input_tokens": null,
      "cached_input_tokens": null,
      "output_tokens": null,
      "reference_loads": null,
      "additional_confirmations": null,
      "retries": null
    }
  }
]
